estado,municipio,curso,ies,conceito_curso,nota_enem_ultimo_ampla,nota_enem_ultimo_ppiq,nota_enem_ultimo_pcd
AC,CRUZEIRO DO SUL,MEDICINA,AFYA FACULDADE DE CIÊNCIAS MÉDICAS DE CRUZEIRO DO SUL (24547),0,720.06,681.74,666.62
AC,RIO BRANCO,MEDICINA,CENTRO UNIVERSITÁRIO UNINORTE (2132),5,727.90,688.84,719.88
AL,MACEIÓ,MEDICINA,AFYA CENTRO UNIVERSITÁRIO UNIMA (4530),5,777.58,718.28,680.40
AL,MACEIÓ,MEDICINA,CENTRO UNIVERSITÁRIO CESMAC (621),5,,772.86,743.76
AP,MACAPÁ,MEDICINA,FACULDADE INTEGRADO DE MACAPÁ/AP (28557),4,754.76,,761.68
AM,ITACOATIARA,MEDICINA,AFYA FACULDADE DE CIÊNCIAS MÉDICAS DE ITACOATIARA (24548),0,718.50,646.06,567.04
